{
  "$schema": "https://apps.bridgething.com/schemas/catalog/v1.json",
  "schema": "catalog.v1",
  "updated_at": "2026-08-30T17:08:40Z",
  "repo": {
    "name": "bridgething apps",
    "description": "The official catalog of installable webapps for bridgething.",
    "homepage": "https://bridgething.com/apps",
    "icon": "https://bridgething.com/brand/icon-dark.svg"
  },
  "apps": [
    {
      "id": "019e6701-13f8-71b5-ba04-85d326630e98",
      "name": "Calendar",
      "description": "Upcoming events from an iCalendar (.ics) feed.",
      "author": "JoeyEamigh",
      "icon": "https://apps.bridgething.com/icons/019e6701-13f8-71b5-ba04-85d326630e98.svg",
      "screenshots": [
        "https://bridgething.com/screenshots/device-calendar.png"
      ],
      "homepage": "https://bridgething.com/apps",
      "source": "https://github.com/JoeyEamigh/bridgething",
      "versions": [
        {
          "version": "0.1.0",
          "released_at": "2026-05-31T00:00:00Z",
          "download": {
            "sha256": "52f9c9bd38e1a355a5258a2d27eb311755d3cb928d43eb3edbc42c99c9f1b319",
            "size": 903700,
            "url": "https://apps.bridgething.com/r/019e6701-13f8-71b5-ba04-85d326630e98/0.1.0.zip"
          },
          "permissions": [
            "net.fetch"
          ],
          "min_libbridgething_version": "0.12.0",
          "changelog": "Initial release."
        }
      ]
    },
    {
      "id": "019e6701-13f8-71b5-ba04-81f347137de2",
      "name": "Weather",
      "description": "Current conditions and a short forecast.",
      "author": "JoeyEamigh",
      "icon": "https://apps.bridgething.com/icons/019e6701-13f8-71b5-ba04-81f347137de2.svg",
      "screenshots": [
        "https://bridgething.com/screenshots/device-weather.png"
      ],
      "homepage": "https://bridgething.com/apps",
      "source": "https://github.com/JoeyEamigh/bridgething",
      "versions": [
        {
          "version": "0.1.0",
          "released_at": "2026-05-31T00:00:00Z",
          "download": {
            "sha256": "b7c60ff4fbb56dc8bca2fde3d261edd99073058616d4cde8c2ceec971ed4e84d",
            "size": 903123,
            "url": "https://apps.bridgething.com/r/019e6701-13f8-71b5-ba04-81f347137de2/0.1.0.zip"
          },
          "permissions": [
            "net.fetch",
            "geo"
          ],
          "min_libbridgething_version": "0.12.0",
          "changelog": "Initial release."
        }
      ]
    },
    {
      "id": "019e7f1a-bcea-7187-a438-4e182be86a33",
      "name": "Home Assistant",
      "description": "Live tiles and controls for a handful of your Home Assistant entities.",
      "author": "JoeyEamigh",
      "icon": "https://apps.bridgething.com/icons/019e7f1a-bcea-7187-a438-4e182be86a33.svg",
      "screenshots": [
        "https://bridgething.com/screenshots/device-home-assistant.png"
      ],
      "homepage": "https://bridgething.com/apps",
      "source": "https://github.com/JoeyEamigh/bridgething",
      "versions": [
        {
          "version": "0.1.1",
          "released_at": "2026-07-27T16:16:00Z",
          "download": {
            "sha256": "fd95103640df5b31c198d4b19df40450efb1b4408ef51f4e44dfae1318feeae0",
            "size": 932086,
            "url": "https://apps.bridgething.com/r/019e7f1a-bcea-7187-a438-4e182be86a33/0.1.1.zip"
          },
          "permissions": [
            "net.ws"
          ],
          "min_libbridgething_version": "0.12.0",
          "changelog": null
        },
        {
          "version": "0.1.0",
          "released_at": "2026-07-26T06:48:02Z",
          "download": {
            "sha256": "251a7c83ebd9ebbf555cc73e1490667c9a0c7484a02993a26a7442b4f0bf8015",
            "size": 929758,
            "url": "https://apps.bridgething.com/r/019e7f1a-bcea-7187-a438-4e182be86a33/0.1.0.zip"
          },
          "permissions": [
            "net.ws"
          ],
          "min_libbridgething_version": "0.12.0",
          "changelog": null
        }
      ]
    }
  ],
  "recommended_sources": []
}
